{
  "$schema": "urn:omarchy:ultimate:capability-schema:window-surface-v0",
  "schemaVersion": "v0",
  "serviceFile": "shell/services/WindowService.qml",
  "brokerFile": "shell/services/CapabilityBroker.qml",
  "ipcFile": "shell/shell.qml",
  "serviceMethods": [
    {
      "name": "windowTitle",
      "kind": "reader",
      "catalogState": "reader",
      "capabilityId": null,
      "debtId": null
    },
    {
      "name": "pin",
      "kind": "writer",
      "catalogState": "broker-catalogued",
      "capabilityId": "window.pin",
      "debtId": null
    },
    {
      "name": "unpin",
      "kind": "writer",
      "catalogState": "broker-catalogued",
      "capabilityId": "window.unpin",
      "debtId": null
    },
    {
      "name": "togglePin",
      "kind": "writer",
      "catalogState": "legacy-direct",
      "capabilityId": "window.toggle-pin",
      "debtId": "legacy.window-service.public-writers"
    },
    {
      "name": "focus",
      "kind": "writer",
      "catalogState": "broker-catalogued",
      "capabilityId": "window.focus",
      "debtId": null
    },
    {
      "name": "close",
      "kind": "writer",
      "catalogState": "broker-catalogued",
      "capabilityId": "window.close",
      "debtId": null
    },
    {
      "name": "closeActive",
      "kind": "writer",
      "catalogState": "broker-catalogued",
      "capabilityId": "window.close-active",
      "debtId": null
    },
    {
      "name": "minimize",
      "kind": "writer",
      "catalogState": "broker-catalogued",
      "capabilityId": "window.minimize",
      "debtId": null
    },
    {
      "name": "restore",
      "kind": "writer",
      "catalogState": "broker-catalogued",
      "capabilityId": "window.restore",
      "debtId": null
    },
    {
      "name": "isActive",
      "kind": "reader",
      "catalogState": "reader",
      "capabilityId": null,
      "debtId": null
    },
    {
      "name": "isMaximized",
      "kind": "reader",
      "catalogState": "reader",
      "capabilityId": null,
      "debtId": null
    },
    {
      "name": "isMinimized",
      "kind": "reader",
      "catalogState": "reader",
      "capabilityId": null,
      "debtId": null
    },
    {
      "name": "toggleFromTaskbar",
      "kind": "writer",
      "catalogState": "legacy-direct",
      "capabilityId": "window.toggle-from-taskbar",
      "debtId": "legacy.window-service.public-writers"
    },
    {
      "name": "activateAtCursorSoon",
      "kind": "writer",
      "catalogState": "legacy-direct",
      "capabilityId": "window.activate-at-cursor-soon",
      "debtId": "legacy.window-service.public-writers"
    },
    {
      "name": "activateAtCursor",
      "kind": "writer",
      "catalogState": "legacy-direct",
      "capabilityId": "window.activate-at-cursor",
      "debtId": "legacy.window-service.public-writers"
    },
    {
      "name": "activate",
      "kind": "writer",
      "catalogState": "broker-catalogued",
      "capabilityId": "window.activate",
      "debtId": null
    },
    {
      "name": "maximize",
      "kind": "writer",
      "catalogState": "broker-catalogued",
      "capabilityId": "window.maximize",
      "debtId": null
    },
    {
      "name": "unmaximize",
      "kind": "writer",
      "catalogState": "broker-catalogued",
      "capabilityId": "window.unmaximize",
      "debtId": null
    },
    {
      "name": "toggleMaximize",
      "kind": "writer",
      "catalogState": "broker-catalogued",
      "capabilityId": "window.toggle-maximize",
      "debtId": null
    },
    {
      "name": "restoreOrMinimize",
      "kind": "writer",
      "catalogState": "legacy-direct",
      "capabilityId": "window.restore-or-minimize",
      "debtId": "legacy.window-service.public-writers"
    },
    {
      "name": "restoreNormal",
      "kind": "writer",
      "catalogState": "broker-catalogued",
      "capabilityId": "window.restore-normal",
      "debtId": null
    },
    {
      "name": "moveTo",
      "kind": "writer",
      "catalogState": "broker-catalogued",
      "capabilityId": "window.move-to",
      "debtId": null
    },
    {
      "name": "resizeTo",
      "kind": "writer",
      "catalogState": "broker-catalogued",
      "capabilityId": "window.resize-to",
      "debtId": null
    },
    {
      "name": "snapLeft",
      "kind": "writer",
      "catalogState": "broker-catalogued",
      "capabilityId": "window.snap-left",
      "debtId": null
    },
    {
      "name": "snapRight",
      "kind": "writer",
      "catalogState": "broker-catalogued",
      "capabilityId": "window.snap-right",
      "debtId": null
    },
    {
      "name": "snapTo",
      "kind": "writer",
      "catalogState": "broker-catalogued",
      "capabilityId": "window.snap-to",
      "debtId": null
    },
    {
      "name": "snapArrow",
      "kind": "writer",
      "catalogState": "broker-catalogued",
      "capabilityId": "window.snap-arrow",
      "debtId": null
    },
    {
      "name": "aeroDragEnd",
      "kind": "writer",
      "catalogState": "legacy-direct",
      "capabilityId": "window.aero-drag-end",
      "debtId": "legacy.window-service.public-writers"
    },
    {
      "name": "saveLayout",
      "kind": "writer",
      "catalogState": "broker-catalogued",
      "capabilityId": "window.save-layout",
      "debtId": null
    },
    {
      "name": "restoreLayout",
      "kind": "writer",
      "catalogState": "broker-catalogued",
      "capabilityId": "window.restore-layout",
      "debtId": null
    },
    {
      "name": "toggleShowDesktop",
      "kind": "writer",
      "catalogState": "broker-catalogued",
      "capabilityId": "window.toggle-show-desktop",
      "debtId": null
    },
    {
      "name": "cycleNext",
      "kind": "writer",
      "catalogState": "legacy-direct",
      "capabilityId": "window.cycle-next",
      "debtId": "legacy.window-service.public-writers"
    },
    {
      "name": "cyclePrev",
      "kind": "writer",
      "catalogState": "legacy-direct",
      "capabilityId": "window.cycle-prev",
      "debtId": "legacy.window-service.public-writers"
    },
    {
      "name": "commitCycle",
      "kind": "writer",
      "catalogState": "legacy-direct",
      "capabilityId": "window.commit-cycle",
      "debtId": "legacy.window-service.public-writers"
    },
    {
      "name": "cancelCycle",
      "kind": "writer",
      "catalogState": "legacy-direct",
      "capabilityId": "window.cancel-cycle",
      "debtId": "legacy.window-service.public-writers"
    },
    {
      "name": "activateFromSwitcher",
      "kind": "writer",
      "catalogState": "legacy-direct",
      "capabilityId": "window.activate-from-switcher",
      "debtId": "legacy.window-service.public-writers"
    },
    {
      "name": "isFullscreen",
      "kind": "reader",
      "catalogState": "reader",
      "capabilityId": null,
      "debtId": null
    },
    {
      "name": "toggleFullscreen",
      "kind": "writer",
      "catalogState": "legacy-direct",
      "capabilityId": "window.toggle-fullscreen",
      "debtId": "legacy.window-service.public-writers"
    },
    {
      "name": "createDesktop",
      "kind": "writer",
      "catalogState": "legacy-direct",
      "capabilityId": "window.create-desktop",
      "debtId": "legacy.window-service.public-writers"
    },
    {
      "name": "switchDesktop",
      "kind": "writer",
      "catalogState": "legacy-direct",
      "capabilityId": "window.switch-desktop",
      "debtId": "legacy.window-service.public-writers"
    },
    {
      "name": "switchToDesktop",
      "kind": "writer",
      "catalogState": "legacy-direct",
      "capabilityId": "window.switch-to-desktop",
      "debtId": "legacy.window-service.public-writers"
    },
    {
      "name": "moveToDesktop",
      "kind": "writer",
      "catalogState": "legacy-direct",
      "capabilityId": "window.move-to-desktop",
      "debtId": "legacy.window-service.public-writers"
    },
    {
      "name": "closeDesktop",
      "kind": "writer",
      "catalogState": "legacy-direct",
      "capabilityId": "window.close-desktop",
      "debtId": "legacy.window-service.public-writers"
    },
    {
      "name": "moveToMonitor",
      "kind": "writer",
      "catalogState": "legacy-direct",
      "capabilityId": "window.move-to-monitor",
      "debtId": "legacy.window-service.public-writers"
    }
  ],
  "ipcPaths": [
    {
      "name": "ping",
      "kind": "health",
      "routing": "read-only",
      "capabilityId": null,
      "targetMethods": [],
      "debtId": null
    },
    {
      "name": "invoke",
      "kind": "generic-writer",
      "routing": "broker-generic",
      "capabilityId": null,
      "targetMethods": [],
      "debtId": null
    },
    {
      "name": "undoLast",
      "kind": "generic-writer",
      "routing": "broker-undo",
      "capabilityId": null,
      "targetMethods": [],
      "debtId": null
    },
    {
      "name": "toggleShowDesktop",
      "kind": "dedicated-writer",
      "routing": "direct-window-service",
      "capabilityId": "window.toggle-show-desktop",
      "targetMethods": [
        "toggleShowDesktop"
      ],
      "debtId": "legacy.window-ipc.direct-routes"
    },
    {
      "name": "snapLeft",
      "kind": "dedicated-writer",
      "routing": "direct-window-service",
      "capabilityId": "window.snap-left",
      "targetMethods": [
        "snapLeft"
      ],
      "debtId": "legacy.window-ipc.direct-routes"
    },
    {
      "name": "snapRight",
      "kind": "dedicated-writer",
      "routing": "direct-window-service",
      "capabilityId": "window.snap-right",
      "targetMethods": [
        "snapRight"
      ],
      "debtId": "legacy.window-ipc.direct-routes"
    },
    {
      "name": "snapTo",
      "kind": "dedicated-writer",
      "routing": "direct-window-service",
      "capabilityId": "window.snap-to",
      "targetMethods": [
        "snapTo"
      ],
      "debtId": "legacy.window-ipc.direct-routes"
    },
    {